[
  {
    "treatment_id": "TRT_01",
    "risk_id": "RSK_01",
    "threat_id": "TH_06",
    "damage_scenario_id": "DS_06",
    "attack_id": "AT_06",
    "impact_id": "IM_06",
    "asset_id": "AS_02",
    "treatment_option": "reduce",
    "treatment_rationale": "RSK_01 is critical; reduce the credential abuse path with controls that bind, rotate, and monitor Refresh Token.",
    "cybersecurity_goal": {
      "goal_id": "CG_01",
      "goal_statement": "The Refresh Token SHALL enforce bound, short-lived, and monitored credential handling to protect confidentiality against Exploit token disclosure through exposed storage, logs, or transport metadata in the handling of Refresh Token..",
      "cal": 4,
      "cal_rationale": "CAL 4 derived from critical risk level for RSK_01.",
      "self_test_note": "This goal fails the self-test if it can be applied without naming Refresh Token and the specific abuse mechanism in AT_06."
    },
    "cybersecurity_claim": null,
    "controls_assigned": [
      {
        "control_id": "CTR_10",
        "control_title": "OAuth Token Rotation and Short-Lived Access Tokens",
        "control_type": "preventive",
        "assignment_rationale": "CTR_10 directly addresses the Exploit token disclosure through exposed storage, logs, or transport metadata in the handling of Refresh Token. mechanism for Refresh Token."
      },
      {
        "control_id": "CTR_12",
        "control_title": "OAuth Token Theft Detection",
        "control_type": "detective",
        "assignment_rationale": "CTR_12 directly addresses the Exploit token disclosure through exposed storage, logs, or transport metadata in the handling of Refresh Token. mechanism for Refresh Token."
      }
    ],
    "avoidance_action": null,
    "cal": 4,
    "residual_risk_expected": "medium",
    "created_timestamp": "2026-06-03T12:00:00.000Z"
  },
  {
    "treatment_id": "TRT_02",
    "risk_id": "RSK_02",
    "threat_id": "TH_21",
    "damage_scenario_id": "DS_21",
    "attack_id": "AT_21",
    "impact_id": "IM_21",
    "asset_id": "AS_05",
    "treatment_option": "reduce",
    "treatment_rationale": "RSK_02 is critical; reduce the credential abuse path with controls that bind, rotate, and monitor OAuth Client Secret / OIDC Config.",
    "cybersecurity_goal": {
      "goal_id": "CG_02",
      "goal_statement": "The OAuth Client Secret / OIDC Config SHALL enforce bound, short-lived, and monitored credential handling to protect confidentiality against Exploit token disclosure through exposed storage, logs, or transport metadata in the handling of OAuth Client Secret / OIDC Config..",
      "cal": 4,
      "cal_rationale": "CAL 4 derived from critical risk level for RSK_02.",
      "self_test_note": "This goal fails the self-test if it can be applied without naming OAuth Client Secret / OIDC Config and the specific abuse mechanism in AT_21."
    },
    "cybersecurity_claim": null,
    "controls_assigned": [
      {
        "control_id": "CTR_02",
        "control_title": "Secure OAuth 2.0 Authorization Flow with PKCE",
        "control_type": "preventive",
        "assignment_rationale": "CTR_02 directly addresses the Exploit token disclosure through exposed storage, logs, or transport metadata in the handling of OAuth Client Secret / OIDC Config. mechanism for OAuth Client Secret / OIDC Config."
      },
      {
        "control_id": "CTR_13",
        "control_title": "Suspicious OAuth Application Consent Detection",
        "control_type": "detective",
        "assignment_rationale": "CTR_13 directly addresses the Exploit token disclosure through exposed storage, logs, or transport metadata in the handling of OAuth Client Secret / OIDC Config. mechanism for OAuth Client Secret / OIDC Config."
      }
    ],
    "avoidance_action": null,
    "cal": 4,
    "residual_risk_expected": "medium",
    "created_timestamp": "2026-06-03T12:00:00.000Z"
  },
  {
    "treatment_id": "TRT_03",
    "risk_id": "RSK_03",
    "threat_id": "TH_03",
    "damage_scenario_id": "DS_03",
    "attack_id": "AT_03",
    "impact_id": "IM_03",
    "asset_id": "AS_01",
    "treatment_option": "reduce",
    "treatment_rationale": "RSK_03 is high; reduce the credential abuse path with controls that bind, rotate, and monitor Access Token (JWT).",
    "cybersecurity_goal": {
      "goal_id": "CG_03",
      "goal_statement": "The Access Token (JWT) SHALL enforce bound, short-lived, and monitored credential handling to protect availability against Exploit token endpoint exhaustion or session-state invalidation loops in the handling of Access Token (JWT)..",
      "cal": 3,
      "cal_rationale": "CAL 3 derived from high risk level for RSK_03.",
      "self_test_note": "This goal fails the self-test if it can be applied without naming Access Token (JWT) and the specific abuse mechanism in AT_03."
    },
    "cybersecurity_claim": null,
    "controls_assigned": [
      {
        "control_id": "CTR_10",
        "control_title": "OAuth Token Rotation and Short-Lived Access Tokens",
        "control_type": "preventive",
        "assignment_rationale": "CTR_10 directly addresses the Exploit token endpoint exhaustion or session-state invalidation loops in the handling of Access Token (JWT). mechanism for Access Token (JWT)."
      },
      {
        "control_id": "CTR_12",
        "control_title": "OAuth Token Theft Detection",
        "control_type": "detective",
        "assignment_rationale": "CTR_12 directly addresses the Exploit token endpoint exhaustion or session-state invalidation loops in the handling of Access Token (JWT). mechanism for Access Token (JWT)."
      }
    ],
    "avoidance_action": null,
    "cal": 3,
    "residual_risk_expected": "low",
    "created_timestamp": "2026-06-03T12:00:00.000Z"
  },
  {
    "treatment_id": "TRT_04",
    "risk_id": "RSK_04",
    "threat_id": "TH_08",
    "damage_scenario_id": "DS_08",
    "attack_id": "AT_08",
    "impact_id": "IM_08",
    "asset_id": "AS_02",
    "treatment_option": "reduce",
    "treatment_rationale": "RSK_04 is high; reduce the credential abuse path with controls that bind, rotate, and monitor Refresh Token.",
    "cybersecurity_goal": {
      "goal_id": "CG_04",
      "goal_statement": "The Refresh Token SHALL enforce bound, short-lived, and monitored credential handling to protect availability against Exploit token endpoint exhaustion or session-state invalidation loops in the handling of Refresh Token..",
      "cal": 3,
      "cal_rationale": "CAL 3 derived from high risk level for RSK_04.",
      "self_test_note": "This goal fails the self-test if it can be applied without naming Refresh Token and the specific abuse mechanism in AT_08."
    },
    "cybersecurity_claim": null,
    "controls_assigned": [
      {
        "control_id": "CTR_10",
        "control_title": "OAuth Token Rotation and Short-Lived Access Tokens",
        "control_type": "preventive",
        "assignment_rationale": "CTR_10 directly addresses the Exploit token endpoint exhaustion or session-state invalidation loops in the handling of Refresh Token. mechanism for Refresh Token."
      },
      {
        "control_id": "CTR_12",
        "control_title": "OAuth Token Theft Detection",
        "control_type": "detective",
        "assignment_rationale": "CTR_12 directly addresses the Exploit token endpoint exhaustion or session-state invalidation loops in the handling of Refresh Token. mechanism for Refresh Token."
      }
    ],
    "avoidance_action": null,
    "cal": 3,
    "residual_risk_expected": "low",
    "created_timestamp": "2026-06-03T12:00:00.000Z"
  },
  {
    "treatment_id": "TRT_05",
    "risk_id": "RSK_05",
    "threat_id": "TH_13",
    "damage_scenario_id": "DS_13",
    "attack_id": "AT_13",
    "impact_id": "IM_13",
    "asset_id": "AS_03",
    "treatment_option": "reduce",
    "treatment_rationale": "RSK_05 is high; reduce the credential abuse path with controls that bind, rotate, and monitor ID Token (JWT claims).",
    "cybersecurity_goal": {
      "goal_id": "CG_05",
      "goal_statement": "The ID Token (JWT claims) SHALL enforce bound, short-lived, and monitored credential handling to protect availability against Exploit token endpoint exhaustion or session-state invalidation loops in the handling of ID Token (JWT claims)..",
      "cal": 3,
      "cal_rationale": "CAL 3 derived from high risk level for RSK_05.",
      "self_test_note": "This goal fails the self-test if it can be applied without naming ID Token (JWT claims) and the specific abuse mechanism in AT_13."
    },
    "cybersecurity_claim": null,
    "controls_assigned": [
      {
        "control_id": "CTR_02",
        "control_title": "Secure OAuth 2.0 Authorization Flow with PKCE",
        "control_type": "preventive",
        "assignment_rationale": "CTR_02 directly addresses the Exploit token endpoint exhaustion or session-state invalidation loops in the handling of ID Token (JWT claims). mechanism for ID Token (JWT claims)."
      },
      {
        "control_id": "CTR_16",
        "control_title": "Role-Based Access Control (RBAC) Design and Enforcement",
        "control_type": "preventive",
        "assignment_rationale": "CTR_16 directly addresses the Exploit token endpoint exhaustion or session-state invalidation loops in the handling of ID Token (JWT claims). mechanism for ID Token (JWT claims)."
      }
    ],
    "avoidance_action": null,
    "cal": 3,
    "residual_risk_expected": "low",
    "created_timestamp": "2026-06-03T12:00:00.000Z"
  },
  {
    "treatment_id": "TRT_06",
    "risk_id": "RSK_06",
    "threat_id": "TH_18",
    "damage_scenario_id": "DS_18",
    "attack_id": "AT_18",
    "impact_id": "IM_18",
    "asset_id": "AS_04",
    "treatment_option": "reduce",
    "treatment_rationale": "RSK_06 is high; reduce the credential abuse path with controls that bind, rotate, and monitor Django Session Cookie / Session State.",
    "cybersecurity_goal": {
      "goal_id": "CG_06",